{
  "$schema": "https://json-schema.org/draft/2020-12/schema",
  "$id": "https://atlas.local/schema/atlas-evaluation-artifact-index-v1.schema.json",
  "title": "Atlas evaluation release artifact index version 1",
  "type": "object",
  "additionalProperties": false,
  "required": ["artifact_index_schema_version", "study_id", "release_tag", "artifacts"],
  "properties": {
    "artifact_index_schema_version": { "const": 1 },
    "study_id": { "type": "string", "minLength": 1 },
    "release_tag": { "type": "string", "minLength": 1 },
    "artifacts": {
      "type": "array",
      "minItems": 1,
      "items": {
        "type": "object",
        "additionalProperties": false,
        "required": ["environment_id", "url", "size_bytes", "sha256", "source_revision", "suite_sha256"],
        "properties": {
          "environment_id": { "type": "string", "minLength": 1 },
          "url": { "type": "string", "format": "uri" },
          "size_bytes": { "type": "integer", "minimum": 1 },
          "sha256": { "type": "string", "pattern": "^[0-9a-f]{64}$" },
          "source_revision": { "type": "string", "minLength": 1 },
          "suite_sha256": { "type": "string", "pattern": "^[0-9a-f]{64}$" }
        }
      }
    }
  }
}
